<?xml version="1.0" encoding="UTF-8"?>
<presentation
	xmlns="https://veltzer.org/keynote"
	xmlns:xsi="http://www.w3.org/2001/XMLSchema-instance"
	xsi:schemaLocation="https://veltzer.org/keynote https://veltzer.org/keynote/xsd/keynote.xsd"
	>
	<meta>
		<title>Unicode test</title>
		<author>
			<firstname value="מרק"/>
			<surname value="ולצר"/>
		</author>
		<copyright>this is the copyright</copyright>
		<keywords>
			<keyword value="אחד"/>
			<keyword value="שנים"/>
			<keyword value="שלוש"/>
		</keywords>
	</meta>
	<slide template="bullet">
		<title>?כותרת ללא צידוד</title>
		<bullet align="center">אלמנט ממורכז</bullet>
		<bullet align="left">אלמנט מצודד לימין</bullet>
		<bullet align="right">אלמנט מצודד לשמאל</bullet>
		<bullet align="right">יאת כתיב נאה</bullet>
		<bullet align="right">right bullet</bullet>
		<bullet align="left">left bullet</bullet>
		<bullet align="center">center bullet</bullet>
	</slide>
	<slide template="bullet">
		<title>some English too?</title>
		<bullet>must have one bullet, at least</bullet>
		<bullet>misspell</bullet>
	</slide>
</presentation>
