<?xml version="1.0" encoding="UTF-8"?>
<!-- This presentation is here for me to test various features of keynote. 
	Mark Veltzer, 2011 -->
<presentation
	xmlns="https://veltzer.org/keynote"
	xmlns:xsi="http://www.w3.org/2001/XMLSchema-instance"
	xsi:schemaLocation="https://veltzer.org/keynote https://veltzer.org/keynote/xsd/keynote.xsd">
	<meta>
		<title>
			This is the title
		</title>
		<author>
			<firstname value="Mark" />
			<surname value="Veltzer" />
		</author>
		<copyright>this is the copyright</copyright>
		<keywords>
			<keyword value="one" />
			<keyword value="two" />
			<keyword value="three" />
		</keywords>
	</meta>
	<slide template="center">
		<title>This is the title</title>
		<bullet align="center">The present slide making software</bullet>
		<bullet align="center">
			Mark Veltzer
			<email>mark.veltzer@gmail.com</email>
		</bullet>
	</slide>
	<slide template="flowing">
		<title>What is keynote ?</title>
		<bullet>
			<concept>Present</concept>
			is tool to create presentations from text files.
		</bullet>
		<bullet>The idea is to be able to edit presentations with a regular
			text editor.
		</bullet>
	</slide>
	<slide template="flowing">
		<title>Why should I use keynote ?</title>
		<bullet>You want to keep the source of your presentation in source
			control.</bullet>
		<bullet>You hate using a WYSIWYG editor.</bullet>
		<bullet>It allows many people to work on the same presentation at the
			same time and resolve their differences using common tools.
		</bullet>
		<bullet>
			<code>This is some C code</code>
		</bullet>
		<bullet>It separates content and presentation.
		</bullet>
		<bullet>It forces same look and feel on all of your presentations.
		</bullet>
		<bullet>Presentations look better because they are generated by
			machine and all the text is well aligned.
		</bullet>
		<bullet>You can convert the content to many types: PDF, ODP, HTML and
			more.
		</bullet>
	</slide>
</presentation>
