<?xml version="1.0" encoding="UTF-8"?>
<presentation
	xmlns="https://veltzer.org/keynote"
	xmlns:xsi="http://www.w3.org/2001/XMLSchema-instance"
	xsi:schemaLocation="https://veltzer.org/keynote https://veltzer.org/keynote/xsd/keynote.xsd"
	>
	<meta>
		<title>The keynote slide manager</title>
		<author>
			<firstname value="Mark"/>
			<surname value="Veltzer"/>
		</author>
		<copyright>Copyright (c) 2011, 2012 Mark Veltzer</copyright>
		<keywords>
			<keyword value="keynote"/>
			<keyword value="Mark Veltzer"/>
			<keyword value="presentations"/>
			<keyword value="power point"/>
		</keywords>
	</meta>
	<slide template="center">
		<title>This is the first title</title>
		<bullet><concept>Keynote</concept></bullet>
		<bullet>slides made right</bullet>
		<!-- <vspace/> -->
		<bullet size="small">Mark Veltzer</bullet>
		<bullet size="small"><email>mark.veltzer@gmail.com</email></bullet>
	</slide>
	<slide template="flowing">
		<title>This is the title</title>
		<bullet>1. this is a slide</bullet>
		<bullet>2. with just bullets</bullet>
		<bullet>3. each bullet should fit</bullet>
		<bullet>4. into one line</bullet>
		<bullet>5. you should see exactly</bullet>
		<bullet>6. the number of lines</bullet>
		<bullet>7. you configured to see in each</bullet>
		<bullet>8. slide</bullet>
	</slide>
	<slide template="flowing">
		<title>Slide created without a layout manager</title>
		<bullet>This means that this slide will have a flow layout manager</bullet>
		<bullet>And this is yet another bullet</bullet>
	</slide>
	<slide template="flowing">
		<title>Long Slide</title>
		<bullet>This slide</bullet>
		<bullet>has many</bullet>
		<bullet>many</bullet>
		<bullet>and many</bullet>
		<bullet>very</bullet>
		<bullet>many</bullet>
		<bullet>very</bullet>
		<bullet>many</bullet>
		<bullet>bullets</bullet>
		<bullet>They are intended to make the flow layout break it into a couple of slides</bullet>
	</slide>
	<slide template="flowing">
		<title>What is keynote?</title>
		<bullet><emphasis>Keynote</emphasis> is tool to create presentations from text files.</bullet>
		<bullet>The idea is to be able to edit presentations with a regular text editor.</bullet>
	</slide>
	<slide template="flowing">
		<title>This is a code slide</title>
		<bullet>This is a sample of code:</bullet>
		<bullet>
			<code language="c"><![CDATA[
			int main(int argc,char** argv, char** envp) {
				printf("Hello, World!\n");
				return 0;
			}
			]]></code>
		</bullet>
		<bullet>And this is a discussion of it</bullet>
	</slide>
	<slide template="flowing">
		<title>Features</title>
		<bullet>Syntax highlighting for pieces of code.</bullet>
		<bullet>Presentations can be viewed over the web using a regular browser with no plugins.</bullet>
		<bullet>Presentations are a lot sexier than PDF or PowerPoint</bullet>
		<bullet>Presentations are simple to create, no need for big software</bullet>
		<bullet>Presentations look good on any screen size because of layout manager used within keynote</bullet>
		<bullet>Presentations stay small in size</bullet>
	</slide>
	<slide template="flowing">
		<title>Why should I use keynote ?</title>
		<bullet>You want to keep the source of your presentation in source control.</bullet>
		<bullet>You hate using a <concept>WYSIWYG</concept> editor.</bullet>
		<bullet>It allows many people to work on the same presentation at the same time and resolve their differences using common tools.</bullet>
		<bullet>It separates content and presentation.</bullet>
		<bullet>It forces same look and feel on all of your presentations.</bullet>
		<bullet>Presentations look better because they are generated by machine and all the text is well aligned.</bullet>
		<bullet>You can convert the content to many types: PDF, ODP, HTML and more.</bullet>
	</slide>
	<slide template="flowing">
		<title>Writing presentations in keynote</title>
		<bullet>You can use any editor you like (I use vim)</bullet>
		<bullet>An empty presentation would look like this:</bullet>
		<bullet>
			<code language="xml"><![CDATA[
			<?xml version="1.0" encoding="ISO-8859-1"?>
			<presentation
				xmlns:xsi="https://veltzer.org/keynote/"
				xsi:noNamespaceSchemaLocation="keynote.xsd">
			</presentation>
			]]></code>
		</bullet>
	</slide>
	<slide template="flowing">
		<title>Comparison to other solutions</title>
		<bullet>DocBook is nice but not tuned to slides.</bullet>
		<!-- todo: talk about openoffice, pdf, other tools -->
	</slide>
	<slide template="flowing">
		<title>Browser support</title>
		<bullet>keynote is developed on a recent version of chrome and that is the browser that it supports the best</bullet>
		<bullet>Latest versions of chrome and Firefox are supported.</bullet>
		<bullet>Other browsers will be supported only if users report and help out with bugs.</bullet>
		<bullet>Keynote does use jQuery at the bottom layer and browser independent
		coding and so it is quite portable and bug fixes should not be hard</bullet>
		<bullet>Browser support is an issue which is not of equal importance to all users</bullet>
		<!--
		<subbullet>presenters don't mind installing a browser that works</subbullet>
		<subbullet>websites want keynote to work on all browsers</subbullet>
		-->
		<bullet>This means that if you are a person doing presentations you have more incentive to work
		with keynote even before it reaches maturity with all browsers</bullet>
	</slide>
	<slide template="flowing">
		<title>Keynote philosophy</title>
		<bullet>Content should always be in text files.</bullet>
		<bullet>Customization of graphics and look and feel are not very important.</bullet>
		<bullet>Separation of content and presentation is important.</bullet>
		<bullet>Simplicity in UI is a good thing.</bullet>
		<bullet>Big software is evil. Lots of small pieces of software is good.</bullet>
		<bullet>Mark is always right, especially when he is dead wrong.</bullet>
	</slide>
</presentation>
