<?xml version="1.0" encoding="UTF-8"?>

<presentation
	xmlns="https://veltzer.org/keynote"
	xmlns:xsi="http://www.w3.org/2001/XMLSchema-instance"
	xsi:schemaLocation="https://veltzer.org/keynote file://keynote.xsd"
	>
	<!-- 
	xsi:schemaLocation="https://veltzer.org/keynote https://veltzer.org/keynote/xsd/keynote.xsd
	 -->
	<meta>
		<title>jQuery</title>
		<author>
			<firstname value="Mark"/>
			<surname value="Veltzer"/>
		</author>
		<copyright>Copyright (c) 2011, 2012 Mark Veltzer</copyright>
		<keywords>
			<keyword value="jQuery"/>
			<keyword value="Mark Veltzer"/>
			<keyword value="introduction"/>
			<keyword value="tutorial"/>
			<keyword value="presentation"/>
			<keyword value="keynotejs"/>
		</keywords>
	</meta>
	<slide template="center">
		<title>jQuery</title>
		<bullet>Mark Veltzer</bullet>
		<bullet><email>mark.veltzer@gmail.com</email></bullet>
		<!--image url='jquery.png' description='the jQuery logo'/-->
	</slide>
	<slide template="flow">
		<title>Second jQuery slide</title>
		<bullet>this is a bullet</bullet>
	</slide>
</presentation>
