<?xml version="1.0" encoding="UTF-8"?>
<presentation
	xmlns="https://veltzer.org/keynote"
	xmlns:xsi="http://www.w3.org/2001/XMLSchema-instance"
	xsi:schemaLocation="https://veltzer.org/keynote https://veltzer.org/keynote/xsd/keynote.xsd"
	>
	<meta>
		<title>This is the title</title>
	</meta>
	<slide template="centered">
		<title>This is the first slide</title>
		<bullet>Mark Veltzer</bullet>
		<bullet><email>mark.veltzer@gmail.com</email></bullet>
	</slide>
	<slide template="bullets">
		<title>This is slide 2</title>
		<bullet>This is the first bullet</bullet>
		<bullet>This is the second bullet</bullet>
	</slide>
</presentation>
